[
 {
  "id": "struct-deeprobotics-lynx-m20",
  "category": "robot",
  "subtype": "wheeled_quadruped_inward_knee",
  "subtype_label": "四轮足 · 内膝肘",
  "vendor": "云深处科技 DEEP Robotics",
  "vendor_cn": "云深处科技",
  "model": "山猫 M20",
  "title": "云深处科技 山猫 M20",
  "url": "https://www.deeprobotics.cn/products/detail/1.html",
  "source_tier": "A",
  "verified": 1,
  "last_checked": "2026-10-28",
  "price_cny": null,
  "specs": {
   "dof": null,
   "mass_kg": 35,
   "payload_kg": 15,
   "speed_max_mps": 5,
   "size_mm": "820×430×570（站立）",
   "climb_height_mm": 250,
   "climb_angle_deg": 45,
   "battery": "容量未公布；充电约 1.5 h；自主回充为选配",
   "endurance_h": "3 h（空载）/ 2.5 h（负载）",
   "voltage_V": null,
   "voltage_range_V": null,
   "iface": "Ethernet；外部供电接口 72 V",
   "compute": "八核 64 位工业级处理器 ×2",
   "sensors": "激光雷达 ×2、广角相机 ×2",
   "image_url": "/parts/deeprobotics-lynx-m20.webp",
   "image_source": "ccc 分支（Dichen33 提交）",
   "doc_url": "https://www.deeprobotics.cn/products/detail/1.html",
   "doc_pdf": null,
   "repo_urls": [],
   "urdf_urls": [],
   "ecosystem_id": "deeprobotics_m20"
  },
  "notes": "轮足平台，采用前肘后膝（内膝肘式）腿构型，因此归入「四轮足 · 内膝肘」。官网 2026-10-28 参数：M20 基础版 35 kg（含电池）、持续运行负载 15 kg、空载 3 h/15 km、负载 2.5 h/12 km、极限测试速度 5 m/s（最大工作速度 2 m/s）、最大楼梯 25 cm、最大高台 80 cm、爬坡 45°、IP66、-20~55℃。官网未公布自由度、电池容量与额定电压，均留空；climb_height_mm 取最大楼梯高度 25 cm，最大高台 80 cm 属另一口径，不混填。系列另有 M20 Pro（同重量/负载，算力 ×3）与 M20S（36 kg、负载 35 kg、9 m/s、高台 100 cm、IP67），本条只收 M20 基础版。价格官网未公开，需联系销售；2024 年初代山猫发布价 ¥98,000，与本条 M20 不是同一代产品。腿构型见官方新闻稿及媒体报道，官网参数表未单列该行。",
  "origin": "云深处科技官网 山猫M20系列产品页参数表核对（2026-10-28）"
 },
 {
  "id": "struct-deeprobotics-lite3",
  "category": "robot",
  "subtype": "quadruped",
  "subtype_label": "四足",
  "vendor": "deeprobotics",
  "vendor_cn": "云深处 DEEP Robotics",
  "model": "Lite3",
  "title": "DEEP Robotics Lite3",
  "url": "https://www.deeprobotics.cn/robot/index/lite3.html",
  "source_tier": "B",
  "verified": false,
  "last_checked": "2026-10-29",
  "price_cny": null,
  "origin": "本地 URDF（deep_robotics_model/Lite3）数关节 12、总质量 11.94 kg",
  "notes": "云深处面向科研/教育的小四足，**官方描述仓 deep_robotics_model 是国内少见的规范 URDF 集合**（Lite3 / X30 / M20 一套）。训练侧有 rl_training、sdk_deploy、m20_rl_isaacsim 等配套工程，属于「官方给描述、社区补训练」的形态。",
  "specs": {
   "dof": 12,
   "mass_kg": 11.94,
   "payload_kg": null,
   "speed_max_mps": null,
   "size_mm": null,
   "climb_height_mm": null,
   "climb_angle_deg": null,
   "battery": null,
   "endurance_h": null,
   "voltage_V": null,
   "voltage_range_V": null,
   "iface": null,
   "compute": null,
   "sensors": null,
   "image_url": null,
   "image_source": null,
   "doc_url": null,
   "doc_pdf": null,
   "repo_urls": [
    "https://github.com/DeepRoboticsLab/deep_robotics_model"
   ],
   "urdf_urls": [
    "https://github.com/DeepRoboticsLab/deep_robotics_model"
   ],
   "ecosystem_id": "deeprobotics_lite3",
   "repo_license": null
  }
 }
]
