[
 {
  "id": "struct-zex-w",
  "category": "robot",
  "subtype": "wheeled",
  "subtype_label": "轮足",
  "vendor": "zex",
  "vendor_cn": "ZEX（个人项目）",
  "model": "ZEX-W",
  "title": "ZEX-W 16DOF 轮足",
  "url": "https://github.com/zeitvex/RC_WheelLeg",
  "source_tier": "A",
  "verified": true,
  "last_checked": "2026-10-30",
  "price_cny": null,
  "origin": "仓库 README（构型/平台/成绩；整机质量 18.0377 kg 亦写在此）+ MJCF 逐个数 hinge 关节（16 个）。核对 2026-10-30",
  "notes": "山东华宇工学院 HYNova 战队的 16DOF 串联轮足，Robocon 仿生足式障碍赛全国一等奖第 7 名；机械、硬件、固件、训练、部署与 BOM 全量开源，是「一支新队伍从零到最后一场比赛」的完整样本。轮腿每条腿 3 个关节 + 1 个驱动轮，16 个 RS02 执行器；控制线是 RL 训练（mjlab）→ MuJoCo sim2sim → Python 与 ROS 2/C++ 双线真机部署，机上跑 Jetson Orin Nano 8G。整机质量 18.04 kg 取自新版 MJCF 的惯性质量合计；仓库里 config.py 的解析常量仍是历史值 12.3 kg（旧版模型），做 MPC 类计算前要按目标机械状态重新核。",
  "specs": {
   "dof": 16,
   "mass_kg": 18.04,
   "payload_kg": null,
   "speed_max_mps": null,
   "size_mm": null,
   "climb_height_mm": null,
   "climb_angle_deg": null,
   "battery": null,
   "endurance_h": null,
   "voltage_V": null,
   "voltage_range_V": null,
   "iface": "CAN（16 × RS02 执行器）",
   "compute": "Jetson Orin Nano 8G",
   "sensors": null,
   "image_url": null,
   "image_source": null,
   "doc_url": "https://github.com/zeitvex/RC_WheelLeg#readme",
   "doc_pdf": null,
   "repo_urls": [
    "https://github.com/zeitvex/RC_WheelLeg"
   ],
   "urdf_urls": [],
   "ecosystem_id": "zex-w",
   "repo_license": null
  }
 }
]
