[
 {
  "id": "struct-stanford-doggo",
  "category": "robot",
  "subtype": "quadruped",
  "subtype_label": "四足",
  "vendor": "Stanford Student Robotics",
  "vendor_cn": "斯坦福学生机器人协会",
  "model": "Doggo",
  "title": "Stanford Doggo",
  "url": "https://github.com/Nate711/StanfordDoggoProject",
  "source_tier": "A",
  "verified": 1,
  "last_checked": "2026-10-28",
  "price_cny": null,
  "specs": {
   "dof": 8,
   "mass_kg": 5,
   "payload_kg": null,
   "speed_max_mps": null,
   "size_mm": "420×200×140（机身）",
   "climb_height_mm": null,
   "climb_angle_deg": null,
   "battery": null,
   "endurance_h": null,
   "voltage_V": null,
   "voltage_range_V": null,
   "iface": null,
   "compute": "Teensy 3.5 + 4× ODrive",
   "sensors": null,
   "image_url": "/parts/stanford-doggo.jpg",
   "image_source": "ccc 分支（Dichen33 提交）",
   "doc_url": null,
   "doc_pdf": null,
   "repo_urls": [
    "https://github.com/Nate711/StanfordDoggoProject",
    "https://github.com/Nate711/Doggo"
   ],
   "urdf_urls": [
    "https://github.com/RajPShinde/Doggo_Description/tree/master/urdf"
   ]
  },
  "notes": "8 个电机（每腿 2 个）、整机不足 5 kg（按 5 记），BOM 低于 US$3,000，控制器为 Teensy 3.5 + 4× ODrive；腿部五杆机构含被动连杆。社区 URDF（RajPShinde/Doggo_Description）有 20 个可动关节，不能当作驱动自由度。项目官网 doggo.stanford.edu 已无法访问，参数以官方 GitHub 仓库为准；官方未公布负载、速度、电池与续航，均留空。",
  "origin": "Stanford Doggo 官方 GitHub 仓库 + 社区 URDF 关节数核对（2026-10-28）"
 },
 {
  "id": "struct-stanford-pupper-v3",
  "category": "robot",
  "subtype": "quadruped",
  "subtype_label": "四足",
  "vendor": "Stanford Student Robotics",
  "vendor_cn": "斯坦福学生机器人协会",
  "model": "Pupper v3",
  "title": "Stanford Pupper v3",
  "url": "https://github.com/stanfordroboticsclub/StanfordQuadruped",
  "source_tier": "A",
  "verified": 1,
  "last_checked": "2026-10-28",
  "price_cny": null,
  "specs": {
   "dof": 12,
   "mass_kg": 3,
   "payload_kg": null,
   "speed_max_mps": null,
   "size_mm": "250×200×220（蹲伏）",
   "climb_height_mm": null,
   "climb_angle_deg": null,
   "battery": null,
   "endurance_h": null,
   "voltage_V": null,
   "voltage_range_V": null,
   "iface": null,
   "compute": "Raspberry Pi 5（8 GB）",
   "sensors": "BNO086 IMU、IMX296 222° 鱼眼相机、麦克风",
   "image_url": "/parts/stanford-pupper.jpg",
   "image_source": "ccc 分支（Dichen33 提交）",
   "doc_url": "https://pupper.readthedocs.io/",
   "doc_pdf": null,
   "repo_urls": [
    "https://github.com/stanfordroboticsclub/StanfordQuadruped"
   ],
   "urdf_urls": []
  },
  "notes": "12 自由度（每腿 3 个 GIM4305 减速电机，10:1），整机约 3 kg。关节约 3.5 N·m 峰值 / 1.0 N·m 连续（风冷），空载约 30 rad/s；控制器为 Raspberry Pi 5（8 GB），配 BNO086 IMU、IMX296 222° 鱼眼相机、4 英寸 LCD 与 3 W 扬声器，BOM 约 US$2,000。官方仓库没有提供 URDF，urdf_urls 留空；负载、速度、电池与续航官方文档未给，均留空。",
  "origin": "Pupper 官方文档（pupper.readthedocs.io）+ StanfordQuadruped 仓库核对（2026-10-28）"
 }
]
